{
  "kind": "scenery.docs.index",
  "schema_revision": "sha256:f7dd1d1f35accc8e6d7709db084650bcebc74321fd74b1f0faa283dab0e5d6b4",
  "generated_at": "2026-06-07T00:00:00Z",
  "owner_default": "scenery maintainers",
  "freshness_policy": {
    "default_review_days": 30,
    "quality_grades": [
      "A",
      "B",
      "C",
      "D"
    ],
    "freshness_states": [
      "current",
      "review_due",
      "stale"
    ]
  },
  "documents": [
    {
      "path": "docs/plans/0218-telemetry-improvements.md",
      "title": "Telemetry Improvements",
      "owner": "scenery telemetry",
      "status": "completed",
      "quality": "A",
      "freshness": "current",
      "last_reviewed": "2026-10-08",
      "review_after": "2026-11-07",
      "summary": "Completed twelve Oracle telemetry reviews with verified report/query/ZIP/status corrections, exact numeric schema checks and owned acceptance. Loop manually stopped; combined landing and source installation are authorized, with exact delivery receipts in local state. Resource budgets remain separate.",
      "tags": [
        "plans",
        "execplans",
        "telemetry",
        "observability"
      ]
    },
    {
      "path": "docs/plans/0216-verification-coverage-and-evidence.md",
      "title": "Verification Coverage and Trustworthy Timing",
      "owner": "scenery verifier / validation",
      "status": "completed",
      "quality": "A",
      "freshness": "current",
      "last_reviewed": "2026-10-07",
      "review_after": "2026-11-06",
      "summary": "Completed explicit JS coverage, native Go lifecycle and completeness, immutable validation/runner evidence, qualified timing baselines, frontend acceptance and attributable current-head CI; recorded performance findings remain with affected packages and plan 0145.",
      "tags": [
        "plans",
        "execplans",
        "harness",
        "validation",
        "timing"
      ]
    },
    {
      "path": "docs/schemas/scenery.harness.self.summary.schema.json",
      "title": "scenery.harness.self.summary Schema",
      "owner": "scenery verifier / validation",
      "status": "reference",
      "quality": "A",
      "freshness": "current",
      "last_reviewed": "2026-10-07",
      "review_after": "2026-11-06",
      "summary": "Checked verification evidence, selection, identity, timing and completeness contract.",
      "tags": [
        "schemas",
        "harness",
        "validation",
        "telemetry"
      ]
    },
    {
      "path": "docs/schemas/scenery.validation.result.schema.json",
      "title": "scenery.validation.result Schema",
      "owner": "scenery verifier / validation",
      "status": "reference",
      "quality": "A",
      "freshness": "current",
      "last_reviewed": "2026-10-07",
      "review_after": "2026-11-06",
      "summary": "Checked verification evidence, selection, identity, timing and completeness contract.",
      "tags": [
        "schemas",
        "harness",
        "validation",
        "telemetry"
      ]
    },
    {
      "path": "docs/schemas/scenery.validation.plan.schema.json",
      "title": "scenery.validation.plan Schema",
      "owner": "scenery verifier / validation",
      "status": "reference",
      "quality": "A",
      "freshness": "current",
      "last_reviewed": "2026-10-07",
      "review_after": "2026-11-06",
      "summary": "Checked verification evidence, selection, identity, timing and completeness contract.",
      "tags": [
        "schemas",
        "harness",
        "validation",
        "telemetry"
      ]
    },
    {
      "path": "docs/schemas/scenery.harness.test_timing.schema.json",
      "title": "scenery.harness.test_timing Schema",
      "owner": "scenery verifier / validation",
      "status": "reference",
      "quality": "A",
      "freshness": "current",
      "last_reviewed": "2026-10-07",
      "review_after": "2026-11-06",
      "summary": "Checked verification evidence, selection, identity, timing and completeness contract.",
      "tags": [
        "schemas",
        "harness",
        "validation",
        "telemetry"
      ]
    },
    {
      "path": "docs/schemas/scenery.telemetry.export.schema.json",
      "title": "scenery.telemetry.export Schema",
      "owner": "scenery verifier / validation",
      "status": "reference",
      "quality": "A",
      "freshness": "current",
      "last_reviewed": "2026-10-07",
      "review_after": "2026-11-06",
      "summary": "Checked verification evidence, selection, identity, timing and completeness contract.",
      "tags": [
        "schemas",
        "harness",
        "validation",
        "telemetry"
      ]
    },
    {
      "path": "docs/schemas/scenery.harness.verification.schema.json",
      "title": "scenery.harness.verification Schema",
      "owner": "scenery verifier / validation",
      "status": "reference",
      "quality": "A",
      "freshness": "current",
      "last_reviewed": "2026-10-07",
      "review_after": "2026-11-06",
      "summary": "Checked verification evidence, selection, identity, timing and completeness contract.",
      "tags": [
        "schemas",
        "harness",
        "validation",
        "telemetry"
      ]
    },
    {
      "path": "docs/schemas/scenery.harness.test_results.schema.json",
      "title": "scenery.harness.test_results Schema",
      "owner": "scenery verifier / validation",
      "status": "reference",
      "quality": "A",
      "freshness": "current",
      "last_reviewed": "2026-10-07",
      "review_after": "2026-11-06",
      "summary": "Checked verification evidence, selection, identity, timing and completeness contract.",
      "tags": [
        "schemas",
        "harness",
        "validation",
        "telemetry"
      ]
    },
    {
      "path": "docs/schemas/scenery.agent.status.schema.json",
      "title": "Agent Status Schema",
      "owner": "scenery runtime / telemetry",
      "status": "reference",
      "quality": "A",
      "freshness": "current",
      "last_reviewed": "2026-10-07",
      "review_after": "2026-11-06",
      "summary": "Checked agent inventory contract with independent root, source, owner, metadata and serving identity state.",
      "tags": [
        "schemas",
        "contract",
        "runtime",
        "telemetry"
      ]
    },
    {
      "path": "docs/schemas/scenery.telemetry.schema.json",
      "title": "CLI Telemetry Schema",
      "owner": "scenery runtime / telemetry",
      "status": "reference",
      "quality": "A",
      "freshness": "current",
      "last_reviewed": "2026-10-07",
      "review_after": "2026-11-06",
      "summary": "Checked CLI telemetry query contract with independent execution purpose and dirty build state.",
      "tags": [
        "schemas",
        "contract",
        "runtime",
        "telemetry"
      ]
    },
    {
      "path": "docs/plans/0215-telemetry-reliability-closure.md",
      "title": "Telemetry Reliability Closure",
      "owner": "scenery runtime / telemetry",
      "status": "completed",
      "quality": "A",
      "freshness": "current",
      "last_reviewed": "2026-10-07",
      "review_after": "2026-11-06",
      "summary": "Closes the October 6 telemetry review with verification isolation, retained archive coverage, typed diagnostics, coherent source recovery, missing-source lifecycle and live rollout evidence.",
      "tags": [
        "plans",
        "execplans",
        "runtime",
        "telemetry"
      ]
    },
    {
      "path": "docs/plans/0214-telemetry-driven-reliability.md",
      "title": "Telemetry-Driven Reliability",
      "owner": "scenery runtime / telemetry",
      "status": "completed",
      "quality": "A",
      "freshness": "current",
      "last_reviewed": "2026-10-05",
      "review_after": "2026-11-04",
      "summary": "Five telemetry-driven fixes spanning recorder authentication containment, build blocks, isolated attributable command evidence, latency boundaries and bounded supervisor logs.",
      "tags": [
        "plans",
        "execplans",
        "runtime",
        "telemetry"
      ]
    },
    {
      "path": "docs/plans/0213-eve-071-adapter.md",
      "title": "Eve 0.71 portable assistant adapter",
      "owner": "scenery assistant adapter / build",
      "status": "completed",
      "quality": "B",
      "freshness": "current",
      "last_reviewed": "2026-10-04",
      "review_after": "2026-11-03",
      "summary": "Upgrade the private Eve implementation while preserving canonical portable capsules, dynamic gateway resolution, authenticated control and approvals.",
      "tags": [
        "plans",
        "execplans",
        "assistants",
        "runtime",
        "build"
      ]
    },
    {
      "path": "docs/plans/0212-agent-workflow-main-integration.md",
      "title": "Agent Workflow And Main Integration",
      "owner": "scenery agent workflows / integration",
      "status": "completed",
      "quality": "A",
      "freshness": "current",
      "last_reviewed": "2026-10-04",
      "review_after": "2026-11-03",
      "summary": "Completed integration of agent-context and warning cleanup with current main performance and tracing; restored retry cancellation, passed six named probes and stable zero-diagnostic full verification, then pushed and installed the exact integration commit.",
      "tags": [
        "plans",
        "execplans",
        "agents",
        "integration"
      ]
    },
    {
      "path": "docs/agent-context-evaluation-0211.md",
      "title": "Scoped Agent Context Evaluation",
      "owner": "scenery verifier / agent workflows",
      "status": "reference",
      "quality": "A",
      "freshness": "current",
      "last_reviewed": "2026-10-04",
      "review_after": "2026-11-03",
      "summary": "Repeated frozen before/after evaluations of documentation validation, normative TypeScript discovery and interruption resumption, with observed context bounds and evidence limits.",
      "tags": [
        "agents",